{
  "$comment": "LiveSpec traceability anchors: @spec(FR-001)",
  "$schema": "https://json-schema.org/draft/2020-12/schema",
  "$id": "https://penflow.local/schemas/semantic-ui-tree.schema.json",
  "title": "Penflow Semantic UI Tree",
  "description": "Pre-Pencil semantic contract produced from flow/screen specs. It captures product intent before .pen drafting or enrichment and before post-implementation runtime UI trees.",
  "type": "object",
  "additionalProperties": false,
  "required": [
    "version",
    "kind",
    "tree_id",
    "source",
    "flows",
    "screens"
  ],
  "properties": {
    "version": {
      "type": "integer",
      "const": 1
    },
    "kind": {
      "type": "string",
      "const": "semantic-ui-tree"
    },
    "tree_id": {
      "type": "string",
      "pattern": "^[a-z][a-z0-9]*(?:[._-][a-z0-9]+)*$"
    },
    "source": {
      "$ref": "#/$defs/sourceMap"
    },
    "flows": {
      "type": "array",
      "minItems": 1,
      "items": {
        "$ref": "#/$defs/flow"
      }
    },
    "screens": {
      "type": "array",
      "minItems": 1,
      "items": {
        "$ref": "#/$defs/screen"
      }
    },
    "system_returns": {
      "type": "array",
      "items": {
        "$ref": "urn:penflow:c51:contracts:v1#/$defs/system-return"
      }
    },
    "requirements": {
      "$ref": "urn:penflow:c51:contracts:v1#/$defs/contract-requirements"
    },
    "outcome_expectations": {
      "type": "array",
      "items": {
        "$ref": "urn:penflow:c51:contracts:v1#/$defs/expected-outcome"
      }
    },
    "verification_policy": {
      "$ref": "urn:penflow:c51:contracts:v1#/$defs/verification-policy"
    }
  },
  "$defs": {
    "flow": {
      "type": "object",
      "additionalProperties": false,
      "required": [
        "id",
        "title",
        "entry_screen",
        "steps",
        "transitions",
        "source_map"
      ],
      "properties": {
        "id": {
          "type": "string",
          "pattern": "^[a-z][a-z0-9]*(?:-[a-z0-9]+)*$"
        },
        "title": {
          "type": "string",
          "minLength": 1
        },
        "priority": {
          "type": "string",
          "enum": [
            "P1",
            "P2",
            "P3"
          ]
        },
        "entry_screen": {
          "type": "string",
          "minLength": 1
        },
        "steps": {
          "type": "array",
          "items": {
            "$ref": "#/$defs/flowStep"
          }
        },
        "transitions": {
          "type": "array",
          "items": {
            "$ref": "#/$defs/transition"
          }
        },
        "source_map": {
          "$ref": "#/$defs/sourceMap"
        }
      }
    },
    "flowStep": {
      "type": "object",
      "additionalProperties": false,
      "required": [
        "id",
        "screen_id",
        "intent"
      ],
      "properties": {
        "id": {
          "type": "string",
          "minLength": 1
        },
        "screen_id": {
          "type": "string",
          "minLength": 1
        },
        "intent": {
          "type": "string",
          "minLength": 1
        },
        "actor": {
          "type": "string"
        }
      }
    },
    "transition": {
      "type": "object",
      "additionalProperties": false,
      "required": [
        "from",
        "to",
        "trigger"
      ],
      "properties": {
        "id": {
          "type": "string"
        },
        "from": {
          "type": "string"
        },
        "to": {
          "type": "string"
        },
        "trigger": {
          "type": "string"
        },
        "condition": {
          "type": "string"
        },
        "action": {
          "type": "string"
        },
        "guard": {
          "type": "string"
        },
        "kind": {
          "type": "string",
          "enum": [
            "navigation",
            "state",
            "environment"
          ]
        },
        "label": {
          "type": "string"
        },
        "causal": {
          "type": "object",
          "additionalProperties": false,
          "required": [
            "version",
            "action_visibility",
            "outcome",
            "fanout"
          ],
          "properties": {
            "version": {
              "const": 1
            },
            "action_visibility": {
              "const": "user-visible"
            },
            "outcome": {
              "type": "string"
            },
            "fanout": {
              "type": "object",
              "additionalProperties": false,
              "required": [
                "group",
                "policy"
              ],
              "properties": {
                "group": {
                  "type": "string"
                },
                "policy": {
                  "enum": [
                    "exclusive",
                    "governed"
                  ]
                },
                "governance": {
                  "type": "string"
                }
              }
            }
          }
        }
      }
    },
    "screen": {
      "type": "object",
      "additionalProperties": false,
      "required": [
        "id",
        "flow_id",
        "surface",
        "viewport",
        "root",
        "states",
        "validations",
        "side_effects",
        "source_map"
      ],
      "properties": {
        "id": {
          "type": "string",
          "minLength": 1
        },
        "flow_id": {
          "type": "string",
          "minLength": 1
        },
        "surface": {
          "type": "string",
          "enum": [
            "mobile",
            "web",
            "landing",
            "showcase",
            "admin"
          ]
        },
        "viewport": {
          "$ref": "#/$defs/viewport"
        },
        "root": {
          "$ref": "#/$defs/semanticNode"
        },
        "states": {
          "type": "array",
          "items": {
            "$ref": "#/$defs/state"
          }
        },
        "validations": {
          "type": "array",
          "items": {
            "$ref": "#/$defs/validation"
          }
        },
        "side_effects": {
          "type": "array",
          "items": {
            "$ref": "#/$defs/sideEffect"
          }
        },
        "source_map": {
          "$ref": "#/$defs/sourceMap"
        }
      }
    },
    "semanticNode": {
      "type": "object",
      "additionalProperties": false,
      "required": [
        "semantic_id",
        "role",
        "source_map"
      ],
      "properties": {
        "semantic_id": {
          "type": "string",
          "pattern": "^[a-z][a-z0-9]*(?:[._-][a-z0-9]+)*$"
        },
        "role": {
          "type": "string",
          "enum": [
            "screen",
            "container",
            "component",
            "text",
            "button",
            "link",
            "input",
            "select",
            "toggle",
            "form",
            "list",
            "list_item",
            "image",
            "icon",
            "navigation",
            "tab",
            "modal",
            "alert",
            "timer",
            "shape"
          ]
        },
        "intent": {
          "type": "string"
        },
        "binding": {
          "type": "string",
          "pattern": "^[a-z][a-z0-9_]*(?:\\.[a-z][a-z0-9_]*)+$"
        },
        "entity": {
          "type": "string"
        },
        "repeat": {
          "type": "string"
        },
        "text": {
          "type": "string"
        },
        "test_id": {
          "type": "string"
        },
        "states": {
          "type": "array",
          "items": {
            "$ref": "#/$defs/state"
          }
        },
        "validations": {
          "type": "array",
          "items": {
            "$ref": "#/$defs/validation"
          }
        },
        "side_effects": {
          "type": "array",
          "items": {
            "$ref": "#/$defs/sideEffect"
          }
        },
        "source_map": {
          "$ref": "#/$defs/sourceMap"
        },
        "children": {
          "type": "array",
          "items": {
            "$ref": "#/$defs/semanticNode"
          }
        },
        "permission": {
          "type": "string",
          "minLength": 1
        }
      }
    },
    "state": {
      "type": "object",
      "additionalProperties": false,
      "required": [
        "name"
      ],
      "properties": {
        "name": {
          "type": "string"
        },
        "when": {
          "type": "string"
        }
      }
    },
    "validation": {
      "type": "object",
      "additionalProperties": false,
      "required": [
        "rule"
      ],
      "properties": {
        "rule": {
          "type": "string"
        },
        "message": {
          "type": "string"
        },
        "source": {
          "type": "string"
        }
      }
    },
    "sideEffect": {
      "type": "object",
      "additionalProperties": false,
      "required": [
        "effect"
      ],
      "properties": {
        "effect": {
          "type": "string"
        },
        "target": {
          "type": "string"
        },
        "when": {
          "type": "string"
        }
      }
    },
    "sourceMap": {
      "type": "object",
      "additionalProperties": false,
      "properties": {
        "flow_spec": {
          "type": "string"
        },
        "screen_spec": {
          "type": "string"
        },
        "mockup": {
          "type": "string"
        },
        "pencil_node_id": {
          "type": [
            "string",
            "null"
          ]
        },
        "notes": {
          "type": "array",
          "items": {
            "type": "string"
          }
        }
      }
    },
    "viewport": {
      "type": "object",
      "additionalProperties": false,
      "required": [
        "width",
        "height"
      ],
      "properties": {
        "width": {
          "type": "number"
        },
        "height": {
          "type": "number"
        }
      }
    }
  }
}
