{
  "version": 1,
  "kind": "semantic-ui-tree",
  "tree_id": "checkout-demo",
  "source": {
    "flow_spec": "examples/demo/flow-ui-contract/flows/checkout.md",
    "screen_spec": "examples/demo/flow-ui-contract/screens/checkout.md",
    "mockup": "examples/demo/ui.pen",
    "notes": [
      "Deterministic schema example for feature 028; not generated by a parser."
    ]
  },
  "flows": [
    {
      "id": "checkout",
      "title": "Checkout",
      "priority": "P1",
      "entry_screen": "checkout",
      "steps": [
        {
          "id": "open-checkout",
          "screen_id": "checkout",
          "intent": "review_cart",
          "actor": "customer"
        },
        {
          "id": "submit-payment",
          "screen_id": "checkout",
          "intent": "submit_payment",
          "actor": "customer"
        }
      ],
      "transitions": [
        {
          "from": "checkout",
          "to": "checkout",
          "trigger": "checkout.pay",
          "condition": "payment_method_present"
        }
      ],
      "source_map": {
        "flow_spec": "examples/demo/flow-ui-contract/flows/checkout.md"
      }
    }
  ],
  "screens": [
    {
      "id": "checkout",
      "flow_id": "checkout",
      "surface": "web",
      "viewport": {
        "width": 390,
        "height": 844
      },
      "states": [
        {
          "name": "default"
        },
        {
          "name": "submitting",
          "when": "payment request is in flight"
        }
      ],
      "validations": [
        {
          "rule": "payment_method_present",
          "message": "Choose a payment method before paying.",
          "source": "checkout.pay"
        }
      ],
      "side_effects": [
        {
          "effect": "create_payment_intent",
          "target": "payment",
          "when": "checkout.pay is submitted"
        }
      ],
      "source_map": {
        "screen_spec": "examples/demo/flow-ui-contract/screens/checkout.md",
        "mockup": "examples/demo/ui.pen",
        "pencil_node_id": "screen"
      },
      "root": {
        "semantic_id": "checkout",
        "role": "screen",
        "states": [
          {
            "name": "default"
          }
        ],
        "source_map": {
          "screen_spec": "examples/demo/flow-ui-contract/screens/checkout.md",
          "pencil_node_id": "screen"
        },
        "children": [
          {
            "semantic_id": "checkout.title",
            "role": "text",
            "text": "Checkout",
            "source_map": {
              "screen_spec": "examples/demo/flow-ui-contract/screens/checkout.md",
              "pencil_node_id": "title"
            }
          },
          {
            "semantic_id": "checkout.pay",
            "role": "button",
            "intent": "submit_payment",
            "binding": "checkout.payment_method",
            "entity": "payment",
            "test_id": "checkout-pay",
            "states": [
              {
                "name": "enabled",
                "when": "payment_method_present"
              },
              {
                "name": "disabled",
                "when": "payment_method_missing"
              }
            ],
            "validations": [
              {
                "rule": "payment_method_present",
                "message": "Choose a payment method before paying."
              }
            ],
            "side_effects": [
              {
                "effect": "create_payment_intent",
                "target": "payment",
                "when": "button is submitted"
              }
            ],
            "source_map": {
              "flow_spec": "examples/demo/flow-ui-contract/flows/checkout.md",
              "screen_spec": "examples/demo/flow-ui-contract/screens/checkout.md",
              "mockup": "examples/demo/ui.pen",
              "pencil_node_id": "pay"
            }
          }
        ]
      }
    }
  ]
}
